{
  "policy_id": "ARMILAR_POINT_IN_TIME_BACKTEST_PROTOCOL_V0100",
  "policy_version": "0.10.0",
  "target_metrics": [
    "MONTHLY_CHANGE_PCT",
    "YEAR_OVER_YEAR_CHANGE_PCT"
  ],
  "horizons_months": [0, 1, 3],
  "baselines": [
    "ZERO_CHANGE",
    "LAST_OBSERVED_TARGET",
    "SEASONAL_12M"
  ],
  "accepted_feature_roles": [
    "PRIMARY_RESEARCH_DRIVER",
    "SENSITIVITY_ONLY"
  ],
  "accepted_transformations": [
    "LEVEL",
    "PERIOD_CHANGE_PCT",
    "YEAR_OVER_YEAR_PCT"
  ],
  "minimum_distinct_cutoffs_for_claim": 24,
  "minimum_cases_per_cell_metric_horizon_for_claim": 24,
  "output_decimal_places": 12,
  "gates": {
    "target_archive_claim_allowed": false,
    "backtest_execution_claim_allowed": false,
    "out_of_sample_claim_allowed": false,
    "feature_selection_allowed": false,
    "model_training_allowed": false,
    "model_selection_allowed": false,
    "arm_l_use_allowed": false,
    "shadow_production_allowed": false,
    "monetary_use_allowed": false
  }
}
